{
  "framework": "superpowers",
  "versions": {"claude": "2.1.220", "framework": "6.2.0"},
  "run": {
    "order": 2,
    "started_at": "2026-07-28T23:33:00-03:00",
    "ended_at": "2026-07-29T01:05:38-03:00",
    "tokens": "unavailable",
    "scores": {
      "correctness": 100,
      "requirements_planning": 88,
      "tests": 98,
      "code_quality": 93,
      "review_pr": 100,
      "efficiency": 45
    }
  },
  "phases": [
    {"name": "brainstorm_design", "artifact": "docs/superpowers/specs/2026-07-28-taskflow-design.md"},
    {"name": "plan", "artifact": "docs/superpowers/plans/2026-07-28-taskflow.md", "lines": 3085},
    {"name": "segregated_execution", "tasks": 16, "method": "subagent-driven-development"},
    {"name": "incremental_and_branch_review", "result": "pass_after_fixes"}
  ],
  "verification": [
    {"command": "ruff check . && mypy app && pytest -q", "result": "pass", "tests": 43},
    {"command": "npm run lint && npm run typecheck && npm test -- --run && npm run build", "result": "pass", "tests": 42},
    {"command": "npm run e2e", "result": "pass", "tests": 1}
  ],
  "repository": {
    "path": "/Users/matheusjericopalhares/work2/superpowers",
    "commit": "12ba4ad"
  },
  "pr": {"title": "feat: add TaskFlow", "body_path": "PR.md"},
  "limitations": [
    "Interactive run telemetry did not expose a comparable exact token total.",
    "The 3085-line plan reproduced substantial implementation code, increasing context and review cost.",
    "Three FastAPI/Starlette deprecation warnings remain."
  ]
}
